{
  "schema_version": 1,
  "environment_id": "milestone-13-lavapipe",
  "cpu_model": "11th Gen Intel(R) Core(TM) i7-1185G7 @ 3.00GHz",
  "physical_memory_bytes": 16479256576,
  "os_version": "Arch Linux; Linux 7.2.2-arch1-1 x86_64",
  "gpu_driver": "Mesa Lavapipe 26.2.1; LLVM 22.1.8",
  "power_profile": "intel_pstate active; balance_performance",
  "notes": "Mesa llvmpipe software Vulkan implementation; release build with profiling enabled"
}
